BK150,砂土,,5.300,5.300,浅黄色，松散，不饱和，不可塑，主要由石英砂、碎石组成，上部含植 物根系,BK149,砂土,新生界第四系,11.200,11.200,  黄色，松散，不饱和，主要由石英砂、碎石组成，上部含植物根系，下部含砾石，未胶结,BK148,砂土,新生界第四系,3.400,3.400,"土黄色，松散，主要由风成砂土，坡积砂土组成,顶部富含现代植物根系 ，底部含砾。",BK147,砂土,,7.500,7.500,  土黄色，松散，主要由风成砂土、坡积砂土组成，顶部为腐殖土，富含现代植物根系，底部含砾。,BK146,含砾泥岩,,17.850,17.850,"灰绿色，泥质结构，块状，断口不规则状，砾多以英岩砾，火成岩砾组 成，砾径2-10mm,大者可达30mm,多呈棱角状，分选差。",BK145,砂质泥岩,,9.300,9.300,  褐黄色，半胶结状，砂多以细砂为主，分布不均一。松软易碎，局部含砾。,BK144,砂土,,7.300,7.300,土黄色，松散，主要由风成砂土、坡积砂土组成，顶部为腐殖土，富含 现代植物根系，底部含砾。,BK143,砂土,,3.000,3.000,  土黄色，松散，主要由风成砂土、坡积砂土组成，顶部富含现代植物根系，底部含砾。,BK142,砂砾石,新生界第四系,0.740,0.740,主为黄色，土黄色，主要成分砂土，亚砂土构成，下部有大量角砾石， 疏松。,BK141,砂土,,3.000,3.000,  土黄色，松散，主要由风成砂土、坡积砂土组成，顶部富含现代植物根系，底部含砾。,BK140,含砾泥岩,上白垩统,22.320,22.320,灰绿色，泥质结构，块状，断口不规状，砾多以石英岩砾，火成岩砾为 主，砾径2-10mm，大者可达30mm，多呈次棱角状，分选差，胶结差，易碎,BK139,砂砾石,,0.610,0.610,  主为黄色，土黄色，主要成分砂土，亚砂土构成，下部有大量角砾石，疏松。,BK138,砂土,,5.000,5.000,土黄色，松散，主要由风成砂土、坡积砂土组成，顶部为腐殖土，富含 现代植物根系，下部含砾。,BK137,砂土,,5.000,5.000,  土黄色，松散，主要由风成砂土、坡积砂土组成，顶部为腐殖土，富含现代植物根系，下部含砾。,BK136,砂土,新生界第四系,10.500,10.500,土黄色，松散，主要由风成砂土、坡积砂土组成，顶部为腐殖土，含现 代植物根系，底部含砾。
BK150,粗砂岩,新生界第四系,10.250,4.950,黄色，主要由长石、石英组成，分选差，磨圆差，胶结松散，不饱和,BK149,砾岩,,33.740,22.540,  灰绿色，粗砾结构，泥质胶结，成分以石英砾为主，砾石直径φ3-55mm，分选差，磨圆差，基底式胶结，胶结松散,BK148,砂砾岩,,11.300,7.900,"土黄色，松散，砾多以英岩砾，火成岩砾组成，砾径2-10mm,多呈次棱角 状，分选差。",BK147,砂砾岩,新生界第四系,13.200,5.700,"  土黄色，松散，主要由石英岩砾，火成岩砾组成，砾径10-20mm,大者可达30mm,多呈次圆状，分选差。",BK146,砂质泥岩,,24.000,6.150,灰绿色，泥质结构，块状构造，断口不规则状，砂多以细砂为主，分布 不均一，固结程度差，松软，易碎，风化后呈碎块状。,BK145,含砾泥岩,,24.500,15.200,  灰绿色，泥质结构，块状，断口不规则状，砾多以石英岩砾，火成岩砾为主，砾径2-10mm，大者30mm，多呈次棱角状，分选差，砾含量50%左右。,BK144,砂砾岩,新生界第四系,12.500,5.200,"土黄色，松散，主要由石英岩砾，火成岩砾组成，砾径10-20mm,多呈次 棱角状，分选差。",BK143,砂砾岩,新生界第四系,9.000,6.000,"  土黄色，松散，主要由石英岩砾，火成岩砾组成，砾径2-30mm,多呈次棱角状，分选差。",BK142,砂砾岩,,5.730,4.990,杂色，砾石成分，主要分石英岩，变质岩等，分选差，次圆状，及次棱 角状，最大砾径47mm，松散，未胶结。,BK141,砂砾岩,新生界第四系,6.000,3.000,"  土黄色，松散，主要由石英岩砾，火成岩砾组成，砾径2-30mm,多呈次棱角状，分选差。",BK140,砂质泥岩,,47.400,25.080,深灰色，泥质结构，块状构造，断口平坦状，砂多以粉砂为主，分布不 均一，固结程度差，松软，风化后成碎块状。,BK139,粗砂岩,新生界第四系,4.540,3.930,  杂色，砾石成分，主要分石英岩，变质岩等，分选差，次圆状，及次棱角状，最大砾径47mm，松散，未胶结。,BK138,砂砾岩,新生界第四系,9.000,4.000,"土黄色，松散，主要由石英岩砾，火成岩砾组成，砾径2-10mm,多呈次棱 角状，分选差。",BK137,粘土,新生界第四系,9.000,4.000,  土黄色，半胶结状，主要由粘土矿物组成，具塑性，遇水膨胀，可搓成10-30mm细条，局部含砾。,BK136,砂质泥岩,,16.000,5.500,灰绿色，泥质结构，块状构造，砂多以粉砂为主，分布不均一，断口参 差状，松软，易软化
BK150,含砾泥岩,,19.300,9.050,灰绿色，块状，松软，泥质结构，参差状断口，含较多砾石，砾径φ10 55mm，分选差，磨圆中等,BK149,泥岩,,40.280,6.540,  灰绿色，泥质结构，块状，参差状断口，松软，含砾石，主要为石英砾，砾径6-45mm,BK148,含砾泥岩,,22.600,11.300,"灰绿色，泥质结构，块状构造，断口不规则状，砾多以英岩砾，火成岩 砾组成，砾径10-20mm,多呈次圆状，分选差",BK147,含砾泥岩,,19.570,6.370,"  灰色，微显绿色，泥质结构，块状构造，砾多以英岩砾，火成岩砾组成，砾径2-15mm,大者可达40mm,多呈次圆状，含量约20%左右,岩芯较破碎。",BK146,含砾泥岩,上白垩统,33.000,9.000,"灰绿色，泥质结构，块状，断口不规则状，砾多以英岩砾，火成岩砾组 成，砾径2-10mm,大者可达30mm,多呈棱角状，分选差。",BK145,细粒砂岩,,26.000,1.500,  灰绿色，细砂状结构，厚层状构造，成分以石英为主，长石次之，云母少量，分选差，泥质胶结，胶结差，疏松易碎，局部泥质含量较高。,BK144,含砾泥岩,,19.200,6.700,"灰色，微显绿色，泥质结构，块状构造，砾多以英岩砾，火成岩砾组成 ，砾径2-15mm,大者可达30mm,多呈次圆状，含量约15%左右,局部岩芯破碎",BK143,含砾泥岩,,17.600,8.600,"  灰绿色，泥质结构，块状构造，断口参差状，松软，砾多以英岩砾，火成岩砾组成，砾径10-30mm,大者可达40mm,多呈次圆状，分选差，含量约30%左右。",BK142,含砾泥岩,,15.300,9.570,灰绿色，半胶结状，遇水泥化变软，脱水后易风化呈泥裂特征。层见少 量砾石，砾石为火山岩砾，砾石呈次圆状，磨圆较差，砾径0.5-2cm。,BK141,粘土,,8.200,2.200,  褐黄色，半胶结状，主要由粘土矿物组成，具塑性，遇水膨胀，可搓成10-30mm细条。,BK140,细粒砂岩,,50.690,3.290,灰白色，细砂状结构，厚层状构造，成分以石英为主，长石次之，云母 少量，分选差，泥质胶结，胶结差，均匀层理，疏松，易碎,BK139,含砾泥岩,,13.420,8.880,  灰绿色，半胶结状，遇水泥化变软，脱水后易风化呈泥裂特征。层见少量砾石，砾石为火山岩砾，砾石呈次圆状，磨圆较差，砾径0.5-2cm。,BK138,粘土,,12.400,3.400,土黄色，半胶结状，主要由粘土矿物组成，具塑性，遇水膨胀，局部含 砾。,BK137,砂质泥岩,,18.300,9.300,  灰绿色，泥质结构，块状构造，砂多以粉砂为主，分布不均一，断口参差状，松软。,BK136,砂砾岩,,30.000,14.000,"灰绿色，松散，砾多以英岩砾，火成岩砾组成，砾径10-30mm,大者可达5 0mm,多呈次圆状，分选差，泥质胶结。"
BK150,砾岩,,26.750,7.450,绿色，泥质胶结，砾石成分以石英、长石为主，次圆状，磨圆中等，分 选差，砾径φ6-40mm，松散,BK149,细砂岩,,47.650,7.370,  灰白色，泥质胶结，细粒砂状结构，胶结松散，主要由石英、长石组成，分选一般,BK148,砂质泥岩,,28.300,5.700,灰绿色，泥质结构，块状构造，断口不规则状，砂多以粉砂为主，分布 不均一，固结程度差，松软。,BK147,砂砾岩,,30.200,10.630,"  灰绿色，松散，砂多以细砂为主，砾多以英岩砾，火成岩砾组成，砾径2-20mm,多呈次棱角状，分选差，泥质胶结。",BK146,砂质泥岩,,52.300,19.300,灰色，泥质结构，块状构造，断口不规则状，砂多以粉砂为主，分布不 均一，固结程度差，松软，易碎，夹细砂岩薄层,BK145,含砾泥岩,上白垩统,51.600,25.600,  灰绿色，泥质结构，块状，断口不规则状，砾多以石英岩砾，火成岩砾组成，砾径2-10mm，大者30mm，多呈次棱角状，分选差，砾含量15%左右。,BK144,砂砾岩,,29.970,10.770,"灰绿色，松散，砂多以细砂为主，砾多以英岩砾，火成岩砾组成，砾径2-20mm,多呈次棱角状，分选差，泥质胶结。",BK143,泥岩,,22.200,4.600,  黑灰色，泥质结构，块状构造，松软，断口参差状。,BK142,细砂岩,,16.700,1.400,灰色，细粒砂质结构，层状，成分石英、长石为主，次圆状，分选好， 松散，胶结程度低。偶见火山岩砾,BK141,细粒砂岩,,13.300,5.100,  灰绿色，细粒砂状结构，厚层状构造，成分以石英为主，长石次之，云母及暗色矿物少量，分选差，泥质胶结，均匀层理，疏松，易碎。,BK140,泥岩,,62.970,12.280,深灰色，黑灰色，泥质结构，块状构造，断口平坦状，含少量炭屑，固 结程度差，松软。,BK139,细砂岩,,14.800,1.380,  杂色，细粒砂质结构，层状，成分石英、长石为主，次圆状，分选好，松散，胶结程度低。偶见火山岩砾。,BK138,砂砾岩,,17.600,5.200,"灰色，微显绿色，松散，砂多以细砂为主，含量约40%左右，砾多以英岩 砾，火成岩砾组成，砾径2-10mm,多呈次棱角状，偶见圆状，分选差，泥质 胶结",BK137,砂砾岩,,22.000,3.700,"  灰绿色，松散，多以英岩砾，火成岩砾组成，砾径10-30mm,大者可达50mm,多呈次圆状，分选差，泥质胶结。",BK136,细粒砂岩,,32.500,2.500,灰绿色，细粒砂状结构，厚层状构造，成分以石英为主，长石次之，云 母及暗色矿物少量，分选差，泥质胶结，均匀层理，半坚硬。
BK150,含砾泥岩,,35.280,8.530,灰绿色，块状，松软，泥质结构，含砾石，砾径φ5-45mm，分选一般， 磨圆中等,BK149,砂质泥岩,上白垩统,60.260,12.610,  灰绿色-灰色，泥质胶结，端口平坦，呈块状，裂隙不发育，中间夹薄层灰白色中砂岩,BK148,含砾泥岩,,43.500,15.200,"灰绿色，泥质结构，块状构造，断口不规则状，砾多以英岩砾，火成岩 砾组成，砾径10-30mm,多呈次棱角状，分选差，砾含量约20%。",BK147,泥岩,,40.300,10.100,  灰绿色，泥质结构，块状构造，断口参差状，风化易碎。,BK146,粉砂岩,,55.470,3.170,深灰色，粉砂状结构，厚层状构造，泥质胶结，均匀层理，局部泥质含 量较高。,BK145,砂质泥岩,,62.300,10.700,  灰色，泥质结构，块状构造，断口不规则，砂多以粉砂为主，分布不均一，松软固结程度差，风化易碎。。,BK144,泥岩,,39.600,9.630,灰绿色，泥质结构，块状构造，断口参差状，风化易碎,BK143,砂砾岩,,34.800,12.600,"  灰绿色，松散，砂多以中砂为主，含量约20%左右，砾多以英岩砾，火成岩砾组成，砾径10-30mm,多呈次圆状，泥质胶结。",BK142,泥岩,,25.800,9.100,灰色，层状，含炭屑，参差状断口，含少量长石细砾，偶见黄铁矿结晶 ，半坚硬。,BK141,砂砾岩,,15.000,1.700,"  灰绿色，松散，砂多以中砂为主，含量约20%左右，砾多以英岩砾，火成岩砾组成，砾径10-30mm,多呈次圆状，泥质胶结。",BK140,煤,5煤,63.810,0.840,黑褐色，暗煤为主，丝炭次之，夹亮煤条带，暗淡光泽，呈褐色条痕， 断口平坦状，污手，属暗淡型煤，半坚硬，,BK139,泥岩,,24.460,9.660,  灰色，层状，含炭屑，参差状断口，含少量长石细砾，偶见黄铁矿结晶，半坚硬。,BK138,细粒砂岩,,18.700,1.100,灰绿色，细粒砂状结构，厚层状构造，成分以石英为主，长石次之，云 母少量，分选差，泥质胶结，均匀层理，疏松，易碎，局部含砾。,BK137,粉砂岩,,29.000,7.000,  灰绿色，粉砂状结构，块状构造，泥质胶结，砾多以英岩砾，火成岩砾组成，砾径2-10mm，多呈次圆状，含量约10%左右，松软，易碎。,BK136,粉砂岩,,39.500,7.000,灰绿色，粉砂状结构，厚层状构造，泥质胶结，均匀层理，夹细砂岩薄 层，松软。
BK150,粉砂岩,,40.550,5.270,灰绿色，粉砂状结构，平行层理，断口平坦，松软，夹薄层中砂岩,BK149,泥岩,,73.580,13.320,  灰色，下段局部为灰黑色，泥质结构，块状，断口平坦，松软，含少量砾石,BK148,砂质泥岩,,57.800,14.300,灰绿色，泥质结构，块状构造，断口不规则状，砂多以粉砂为主，分布 不均一，固结程度差，松软,BK147,粉砂岩,上白垩统,45.000,4.700,  灰色，微显绿色，粉砂状结构，厚层状构造，泥质胶结，均匀层理，局部含砾。,BK146,泥岩,,76.810,21.340,灰黑色，泥质结构，块状构造，断口平坦状，含少量炭屑，夹炭质条带 ，固结程度差，风化后呈碎块状，局部夹粉砂岩薄层。,BK145,粉砂岩,,64.840,2.540,  灰色，粉砂状结构，厚层状构造，泥质胶结，均匀层理，局部泥质含量较高。,BK144,粉砂岩,上白垩统,43.620,4.020,灰色，微显绿色，粉砂状结构，厚层状构造，泥质胶结，均匀层理，下 部含砾。,BK143,泥岩,,38.300,3.500,  深灰色，泥质结构，块状构造，断口平坦状，细腻均一。,BK142,砾岩,,38.200,12.400,灰色，块状，基底式胶结，泥质胶结，砾石为火山碎屑岩砾，砾石呈棱 角状，磨圆差，砾径3-8mm，半坚硬。,BK141,含砾泥岩,,30.000,15.000,"  灰绿色，泥质结构，块状构造，断口参差状，松软，砾多以英岩砾，火成岩砾组成，砾径2-20mm,大者可达40mm,多呈次圆状，分选差，含量约15%左右。",BK140,泥岩,5煤,64.350,0.540,深灰色，黑灰色，泥质结构，块状构造，断口平坦状，含少量炭屑，固 结程度差，松软。,BK139,砾岩,,34.730,10.270,  灰色，块状，基底式胶结，泥质胶结，砾石为火山碎屑岩砾，砾石呈棱角状，磨圆差，砾径3-8mm，半坚硬。,BK138,砂砾岩,,27.700,9.000,"灰色，微显绿色，松散，砂多以细砂为主，含量约30%左右，砾多以英岩 砾，火成岩砾组成，砾径10-20mm,多呈次棱角状，偶见圆状，分选差，泥 质胶结。",BK137,砂砾岩,,32.500,3.500,"  灰绿色，松散，砂多以细砂为主，砾多以英岩砾，火成岩砾组成，砾径10-30mm,大者可达50mm，多呈次圆状，分选差。",BK136,泥岩,,41.600,2.100,灰色，微显绿色，泥质结构，块状构造，断口参差状，风化后呈碎块状 ，松软。
BK150,泥岩,,46.670,6.120,灰绿色，泥质结构，块状，局部含少量砾石，平坦状断口，松软,BK149,细砂岩,,76.270,2.690,  灰白色，泥质胶结，细粒砂状结构，主要由石英、长石组成，含少量丝炭，松软,BK148,含砾泥岩,上白垩统,64.840,7.040,"灰绿色，泥质结构，块状构造，断口不规则状，砾多以英岩砾，火成岩 砾组成，砾径10-30mm,多呈次棱角状，分选差，砾含量约20%",BK147,泥岩,,54.500,9.500,  灰色，泥质结构，块状构造，断口平坦状，局部含少量炭化植物碎屑，夹粉砂岩薄层。,BK146,煤,1煤,77.590,0.780,黑褐色，块状，暗煤为主，丝炭次之，夹亮煤条带，暗淡光泽，呈褐色 条痕，断口平坦状，污手，属暗淡型煤，半坚硬，其中有泥岩夹矸2层。,BK145,泥岩,,73.150,8.310,  灰黑色，泥质结构，块状构造，断口平坦状，含少量炭屑，松软，风化后呈碎块状。,BK144,泥岩,,54.000,10.380,灰色，泥质结构，块状构造，断口平坦状，局部含少量炭化植物碎屑， 夹粉砂岩薄层。,BK143,砂砾岩,,45.500,7.200,"  灰绿色，松散，砂多以中砂为主，砾多以英岩砾，火成岩砾组成，砾径2-20mm,多呈次圆状，分选差，泥质胶结。",BK142,泥岩,,46.400,8.200,深灰色，层状，含炭屑，见滑面构造，参差状断口，半坚硬,BK141,泥岩,,42.200,12.200,  黑灰色，微显绿色，泥质结构，块状构造，易软化，断口参差状，易软化，夹粉砂岩薄层。,BK140,煤,5煤,64.740,0.390,黑褐色，暗煤为主，丝炭次之，夹亮煤条带，暗淡光泽，呈褐色条痕， 断口平坦状，污手，属暗淡型煤，半坚硬，,BK139,泥岩,,42.650,7.920,  深灰色，层状，含炭屑，见滑面构造，参差状断口，偶见黄铁矿结晶，半坚硬。,BK138,泥岩,,37.500,9.800,深灰色，微显绿色，泥质结构，块状构造，断口参差状，易软化，风化 后呈碎块状，局部含少量粉砂,BK137,含砾泥岩,,38.400,5.900,  灰绿色，泥质结构，块状构造，断口参差状，砾多以英岩砾，火成岩砾组成，砾径10-20mm，多呈次圆状，分选差，松软。,BK136,砂砾岩,上白垩统,44.400,2.800,"灰绿色，松散，砂多以细砂为主，砾多以英岩砾，火成岩砾组成，砾径1 0-30mm,多呈次圆状，分选中等，泥质胶结。"
BK150,粉砂岩,,48.200,1.530,灰色，粉砂状结构，平行层理，断口平坦，松软,BK149,泥岩,,87.100,10.830,  灰色，泥质结构，块状，断口平坦，平行层理，见滑面，松软，下部和灰黑色粉砂岩互层,BK148,粉砂岩,,72.200,7.360,灰色，粉砂状结构，厚层状构造，泥质胶结，均匀层理，局部泥质含量 较高。,BK147,含砾泥岩,,56.000,1.500,"  灰色，泥质结构，块状构造，断口参差状，砾多以英岩砾，火成岩砾组成，砾径2-10mm,多呈次圆状，分选差，含量约15%左右。",BK146,泥岩,1煤,77.850,0.260,灰黑色，泥质结构，块状构造，断口平坦状，含炭屑，风化后呈碎块状 ，夹炭质条带。,BK145,煤,5煤,73.530,0.380,  黑褐色，块状，暗煤为主，丝炭次之，夹亮煤条带，暗淡光泽，呈褐色条痕，断口平坦状，污手，属暗淡型煤，风化易碎，其中有泥岩夹矸13层，炭质泥岩夹矸4层。,BK144,含砾泥岩,,55.200,1.200,"灰色，泥质结构，块状构造，断口参差状，砾多以英岩砾，火成岩砾组 成，砾径2-10mm,多呈次圆状，分选差，含量约15%左右",BK143,泥岩,,57.600,12.100,  灰色-深灰色，泥质结构，块状构造，断口平坦状，风化后呈碎块状，局部含少量炭化植物碎屑及粉砂。,BK142,砂质泥岩,,47.000,0.600,灰色，块状，砂质均匀，参差状断口，半坚硬,BK141,细粒砂岩,,43.100,0.900,  灰白色，细粒砂状结构，厚层状构造，成分以石英为主，长石次之，云母少量，分选中等，钙质胶结，致密，坚硬，均匀层理。,BK140,泥岩,5煤,64.950,0.210,深灰色，黑灰色，泥质结构，块状构造，断口平坦状，含少量炭屑，固 结程度差，松软。,BK139,砂质泥岩,,43.850,1.200,  深灰色，层状，砂质均匀，含炭屑，参差状断口，偶见黄铁矿结晶，半坚硬。,BK138,砂砾岩,,41.700,4.200,"灰绿色，砂多以细砂为主，含量约20%左右，砾多以英岩砾，火成岩砾组 成，砾径10-30mm,多呈次圆状，分选差，泥质胶结，疏松，易碎，局部泥 质含量较高。",BK137,砂砾岩,,42.800,4.400,"  灰绿色，砂砾状结构，块状构造，砂多以细砂为主，砾多以英岩砾，火成岩砾组成，砾径10-30mm,多呈次圆状，分选差，泥质胶结，疏松，易碎",BK136,泥岩,,55.500,11.100,灰色，泥质结构，块状构造，断口参差状，风化后呈碎块状，局部含粉 砂，松软。
BK150,细砂岩,,52.550,4.350,灰白色，泥质胶结，细粒砂状结构，成分以石英、长石为主，胶结松散 ，松软,BK149,砂质泥岩,,93.130,6.030,  灰黑色，泥质结构，断口平坦，松软，裂隙不发育，含炭屑,BK148,泥岩,,83.680,11.480,深灰色，泥质结构，块状构造，断口平坦状，含少量炭屑。,BK147,泥岩,,78.500,22.500,  深灰色，泥质结构，块状构造，断口平坦状，含炭化植物碎屑及茎叶化石，夹粉砂岩薄层。,BK146,煤,1煤,78.440,0.590,黑褐色，块状，暗煤为主，丝炭次之，夹亮煤条带，暗淡光泽，呈褐色 条痕，断口平坦状，污手，属暗淡型煤，半坚硬，其中有泥岩夹矸3层。,BK145,泥岩,5煤,73.880,0.350,  灰黑色，泥质结构，块状构造，断口平坦状，含少量炭屑，松软，风化后呈碎块状。,BK144,泥岩,,75.480,20.280,深灰色，泥质结构，块状构造，断口平坦状，含炭化植物碎屑及茎叶化 石，夹粉砂岩薄层,BK143,细粒砂岩,上白垩统,59.400,1.800,  浅灰色，细粒砂状结构，厚层状构造，成分以石英为主，长石次之，分选差，泥质胶结，均匀层理。,BK142,含砾细粒砂岩,,50.500,3.500,灰色，细粒砂状结构，层状，成分石英、长石为主，含少许细砾石，次 圆状，分选中等，泥质胶结，半坚硬。,BK141,泥岩,上白垩统,52.500,9.400,  灰色-黑灰色，泥质结构，块状构造，断口平坦状，风化后呈碎块状，局部含少量炭化植物碎屑及粉砂。,BK140,煤,5煤,66.050,1.100,黑褐色，暗煤为主，丝炭次之，夹亮煤条带，暗淡光泽，呈褐色条痕， 断口平坦状，污手，属暗淡型煤，半坚硬，,BK139,含砾细粒砂岩,,47.310,3.460,  灰色，块状，成分石英、长石为主，泥质胶结，砾石为火山碎屑岩砾，砾石呈棱角状，磨圆差，砾径3-8mm，半坚硬。,BK138,含砾泥岩,上白垩统,59.500,17.800,"灰色，微显绿色，泥质结构，块状构造，断口参差状，局部见有滑面， 砾多以英岩砾，火成岩砾组成，砾径10-20mm,多呈次圆状，含量约15%左右",BK137,粉砂岩,上白垩统,47.500,4.700,  灰色，微显绿色，粉砂状结构，厚层状构造，泥质胶结，均匀层理，松软。,BK136,细粒砂岩,,57.070,1.570,灰白色，细粒砂状结构，块状构造，成分以石英为主，长石次之，云母 及暗色矿物少量，分选差，泥质胶结，均匀层理，半坚硬
BK150,泥岩,上白垩统,65.420,12.870,灰绿色-灰色，泥质结构，块状，平坦状断口，具滑面，松软,BK149,煤,5煤,93.600,0.470,"  黑褐色，呈块状，条痕呈褐色，暗淡光泽，平坦状断口,下部内生裂隙不发育，含丝炭，半坚硬，含夹矸12层，夹矸为炭质泥岩、泥岩，标志层位于98.17-98.72m，为灰色泥岩，",BK148,煤,1煤,84.300,0.620,黑褐色，块状，暗煤为主，丝炭次之，夹亮煤条带，暗淡光泽，呈褐色 条痕，断口平坦状，污手，属暗淡型煤。其中有泥岩夹矸1层。,BK147,煤,,78.800,0.300,  黑褐色，块状，暗煤为主，丝炭次之，夹亮煤条带，暗淡光泽，呈褐色条痕，断口平坦状，属暗淡型煤，其中有炭质泥岩夹矸5层，泥岩夹矸2层,BK146,泥岩,1煤,78.700,0.260,灰黑色，泥质结构，块状构造，断口平坦状，含炭屑，风化后呈碎块状 ，夹炭质条带。,BK145,煤,5煤,74.190,0.310,  黑褐色，块状，暗煤为主，丝炭次之，夹亮煤条带，暗淡光泽，呈褐色条痕，断口平坦状，污手，属暗淡型煤，风化易碎，其中有泥岩夹矸13层，炭质泥岩夹矸4层。,BK144,煤,5煤,76.270,0.790,黑褐色，块状，暗煤为主，丝炭次之，夹亮煤条带，暗淡光泽，呈褐色 条痕，断口平坦状，属暗淡型煤，其中有炭质泥岩夹矸5层，泥岩夹矸6层,BK143,粉砂岩,,61.500,2.100,  灰色，粉砂状结构，块状构造，泥质胶结，均匀层理。,BK142,砂质泥岩,,58.100,7.600,深灰色，层状，砂质均匀，含炭屑，参差状断口，半坚硬。,BK141,粉砂岩,,53.200,0.700,  灰色，粉砂状结构，块状构造，泥质胶结，均匀层理。,BK140,泥岩,5煤,66.350,0.300,深灰色，黑灰色，泥质结构，块状构造，断口平坦状，含少量炭屑，固 结程度差，松软。,BK139,砂质泥岩,,53.680,6.370,  深灰色，层状，砂质均匀，含炭屑，参差状断口，偶见黄铁矿结晶，半坚硬。,BK138,泥岩,,68.000,8.500,灰色，泥质结构，块状构造，断口平坦状，细腻，均一，局部见有少量 炭化植物碎屑及茎叶化石。,BK137,泥岩,,57.900,10.400,  灰色，泥质结构，块状构造，断口平坦状，风化后呈碎块状，局部含粉砂，松软。,BK136,泥岩,,59.780,2.710,灰色，深灰色，泥质结构，块状构造，断口平坦状，含少量炭化植物碎 屑和茎叶化石，松软。
